filmID,title,duration,productionYear,ageCategoryName,filmDescription
196,Once arm rate.,103.0,2016,14A,Factor your reason tonight final everything six main. Rich central animal character along.
197,Impact instead.,145.0,2018,14A,Here section history process. Game president first process able. International career result film fall.
198,Try time.,66.0,2016,MA15+,Skin there from card mission spend. Moment arrive artist appear protect.
199,Thank question home.,163.0,2018,PG-13,Win entire discuss better. Television role certainly player present. Environment interview professor my TV address Congress gun.
200,Instead room.,137.0,2020,G,Pull base like national. No fight view wear recently writer. Either cup goal hundred condition system.
201,Worry writer.,83.0,2018,NC-17,Tax stuff or involve level. Usually team image.
202,First manager table.,79.0,2020,15+,Agent share physical share. Eight but me daughter imagine fast bad.
203,Military beyond.,120.0,2017,U,Region her cup knowledge.
204,Teach capital pattern.,77.0,2019,R,Officer alone change city. Minute professional make church.
205,Be consumer agency.,144.0,2019,U,Single four organization rate large success past. Many deep defense outside worry during material way.
206,Also late until.,149.0,2016,MA15+,Book spring window anyone unit establish. Thank TV treat note. Concern station party take sit official.
207,International tonight.,163.0,2016,14A,Full rule just. Teach protect movie film her name travel store.
208,Policy strategy defense.,132.0,2020,16+,Art season interview keep avoid. Help agent production former state.
209,Believe about sign east.,121.0,2018,G,Lawyer key media inside value. Song cause tough baby. End participant thank audience.
210,Bag field.,167.0,2019,U,Particularly how realize network together ready travel recognize. Rock fund amount say democratic I.
211,Interview media Democrat.,119.0,2018,12A,Important never huge play task look. Foreign thing building bring true. Various matter imagine example leg.
212,Light major like movie.,99.0,2015,NC-17,Rock anyone role institution.
213,Among form.,113.0,2019,15+,Learn deep even raise rather compare. Also agent training action well. Wind focus board.
214,Less area.,154.0,2018,PG,Camera through officer good yeah what be. Away across friend Mrs draw. Kind front weight consider black hour.
215,Book this then.,171.0,2019,16+,Congress couple join great worry point.
216,Letter learn.,60.0,2017,R,Significant drop deal go TV painting. Suddenly a wide trip theory. High consider building focus apply discuss. You why including bed this perform.
217,Within matter international.,62.0,2017,U,Writer half art truth fast ok general. Maybe professional you. Analysis evening opportunity argue. Dark agreement try down break would.
218,May ago.,93.0,2021,18+,Grow room green benefit. Us lawyer our message matter. Level new fire.
219,Although career.,165.0,2020,MA15+,Yard team north tree describe. Worry story public. Field first provide position include.
220,Future trial.,121.0,2015,16+,Time nor picture open support. Assume knowledge power scientist. Myself hair above able enjoy.
221,Study despite within exist.,179.0,2015,PG,Story push detail fish. Huge right institution task economy summer. Wonder season rich simply lawyer he. Billion treat third of back.
222,Method behind.,107.0,2018,14A,Wait indicate subject tonight morning ahead trouble. Direction government kind medical clear break general. Happy may green should share say.
223,No example.,105.0,2017,U,Interesting discussion assume if.
224,Anything.,108.0,2018,18+,Measure bar military individual accept significant. Half church country hold social event success sense.
225,On.,152.0,2019,NC-17,Risk let cost reach.
226,Still within.,134.0,2018,PG-13,Well short order of answer issue. Trip until tax. Six democratic lead drive although become training.
227,World future stay.,90.0,2015,PG,Seek will country value attention board his recent. Carry quality recent together.
228,Still head.,159.0,2017,MA15+,Daughter enjoy yeah manager really beautiful. Each continue strategy push Mrs. Look best less.
229,Mission risk available.,85.0,2019,12A,Detail let try bring budget design hand. Ahead similar although country not still result step. Relationship million field allow then yourself though.
230,Short building move.,84.0,2021,15+,Many summer game build everybody. Certainly away time poor development organization population.
231,Question mention politics return.,176.0,2015,16+,Consumer interest family for. Almost mouth relationship role. Defense anyone myself dark.
232,Pass practice.,84.0,2018,PG-13,Enjoy take strategy. Big may great camera. Candidate all six audience involve.
233,Here marriage attack.,146.0,2022,18+,Center same style house. Begin Democrat room would remember the. Hand each no place our.
234,Cover level.,150.0,2022,12A,Want cause ability prepare step happen join. Ahead body election act five smile. Hold open its.
235,Near small.,101.0,2017,18+,Civil in begin may fine. Spring bar ready. Expert maintain always could.
236,East force.,113.0,2016,14A,Network dream because anyone better popular. Much style poor create thank.
237,Partner road.,143.0,2018,PG-13,Realize almost avoid wall. Probably check weight give same else. Information professional must push security back.
238,Five pay imagine.,168.0,2020,15+,Four wind college into family nearly charge. Food wife across. Several store seek note per true public yet.
239,Race cold.,141.0,2018,R,Operation degree couple probably serve change great also. Policy lawyer fact choose half society another assume.
240,Board start.,167.0,2015,12A,Generation other foreign bar field remember reduce. Cultural senior boy training.
241,Hear through.,109.0,2016,14A,Quality child single. Improve tend mission.
242,Nothing wish.,148.0,2018,18+,Agency player me though to.
243,Result big best choice.,140.0,2022,14A,Leave generation beat school. Development fly race late.
244,Or standard down.,160.0,2017,U,Form blue say side gas investment.
245,Write region.,153.0,2018,PG-13,Position relate tend already know. Management author nation picture fund hold.
246,Down father.,95.0,2015,16+,Red subject save walk including type. Effect blue sign market. Consider theory lose high statement hot born. Walk camera consider blood who.
247,Color be growth.,102.0,2016,R,Eye everyone whose edge stock week difficult pretty. Up floor get itself.
248,Open suggest.,176.0,2016,PG,Nature bed early contain. Carry show car citizen hair. Action strategy leg.
249,Speech list take.,68.0,2015,NC-17,Participant feel protect western husband model modern. Art perform summer end north resource.
250,Performance land.,179.0,2020,G,Several city clear network bill ago. They fall woman life. Fine address term among.
251,Leader scientist.,127.0,2017,18+,Question force still today just section. Bag spend other against practice nor possible.
252,Hot personal behavior.,88.0,2019,NC-17,Stop forget high moment general. Thought either forward north. Clearly can everyone.
253,Today camera.,88.0,2019,NC-17,Heavy someone international loss senior should gas herself.
254,Pay TV and.,150.0,2020,16+,Whatever team American most. Set because population also administration. Respond blue player over.
255,Daughter yet business.,96.0,2019,MA15+,Answer out measure concern civil. Make baby again claim. Compare career body.
256,Bring opportunity be.,134.0,2016,12A,Agent investment factor property worker game. Save economic husband fact effort success. According whole whose much true. Evening very cold find majority listen skin.
257,Husband process up.,117.0,2020,12A,Owner social box smile worker read whom. Base here fill.
258,Enter child.,155.0,2019,12A,Each wife key listen.
259,Describe participant.,155.0,2017,PG-13,By some really their the only though team. Billion prevent trouble month door.
260,Our.,122.0,2018,16+,Them per grow price. Fund enter vote while.
261,Glass until.,82.0,2018,MA15+,Write government physical here like two life.
262,Method deal floor bill.,174.0,2018,R,Top hit soldier. College particular ok soldier lay.
263,Respond behavior case.,77.0,2019,16+,View west write suddenly experience. Spend current land. Near money end outside nation build cause.
264,Run figure something.,89.0,2018,PG-13,Whose raise able edge school according daughter. Adult year though executive mind expect.
265,Strategy current.,76.0,2020,PG-13,Accept service office why like may body. Republican high response add ability person.
266,Too training.,119.0,2016,12A,Head set billion course up about or. Tough mean my go all military middle. Tax order usually sense onto.
267,Top traditional.,154.0,2017,16+,Least represent strategy federal. Development yourself according stand seem. Five religious money different.
268,Policy stop.,133.0,2021,18+,Detail executive grow baby before though. Environmental north laugh remain describe save.
269,Citizen baby data.,167.0,2018,U,Pm bed skill follow report conference. Down TV paper production bill north. Prove leg floor million reflect issue.
270,Authority wife.,160.0,2019,MA15+,Light low specific place. Bank financial next coach popular sit. South true policy statement outside. Friend artist central cut coach.
271,Product hold drop.,111.0,2021,18+,Note economic help.
272,Goal.,107.0,2020,12A,Weight near across political institution. President chance apply say. Suggest theory draw inside. Nothing wide those consider maybe short must summer.
273,Large subject fall.,117.0,2019,PG-13,Brother special attack reflect mother such right kid. Per quickly image her be two about. Wait exist thing hot treat ask try.
274,Child bit.,116.0,2017,PG,Chance national brother beyond maybe. Fill be none food approach piece. Rule home economy per part my debate hit.
275,Prove door.,81.0,2022,15+,Far chance day never agency increase. Beyond right medical camera room include.
276,Arm find as commercial.,148.0,2016,12A,Father green city child reveal. Drive if me and see forward sea usually. Official same enter create former. Year result challenge consumer different see.
277,Me wife.,110.0,2019,PG-13,Range fill scientist scientist. Reality number create win. Care service will situation mean create always democratic.
278,Yes provide.,68.0,2019,15+,Author offer station here enjoy. Off record star above.
279,Sell president authority.,114.0,2021,16+,Analysis rule information the you.
280,Quality.,138.0,2016,NC-17,Plan successful other area be discover.
281,Within role nature law.,105.0,2019,PG-13,Exist boy guess. Rate financial impact score interest contain. Least character traditional commercial.
282,Tree business.,118.0,2017,R,Several threat son too. Firm itself company tell style yourself sister a. Less ball eight. Around feel someone all themselves set whose.
283,Imagine.,159.0,2021,16+,American measure senior cost inside color. Huge crime land senior who election mean feel. Degree yourself girl structure behind.
284,Event throw short.,85.0,2020,PG,Democratic worry article certain community deal sometimes. It I trial always. Ready case our deep.
285,General single ask.,160.0,2018,R,Large political parent group. Other stuff subject arm some reduce place score.
286,Camera give.,78.0,2018,16+,Maintain travel never no every executive. Scientist turn ahead catch institution.
287,Good today.,82.0,2020,G,Property course visit series option important artist. Hotel likely responsibility professor occur cell. Ready central treatment specific large simply.
288,Television change.,164.0,2021,G,Bank say everyone my point notice. Resource company base see indeed owner.
289,Image out everybody.,83.0,2022,14A,My whom natural sell wear major. Million care bar much important generation.
290,Project lose.,139.0,2018,16+,Pattern position or military watch toward off. North build appear young. Three third happen once enter nice about.
291,From program avoid.,68.0,2018,R,Then where budget never out including. Wonder newspaper record give right trial if. Teach there administration.
292,Difficult apply fall.,70.0,2020,PG-13,Most attention deal. Style or too might record form.
293,Dark represent study hour.,171.0,2019,16+,White bed science animal. Analysis where three walk appear continue far style.
294,Wrong simply value.,153.0,2022,15+,Civil small magazine size. Own fund of bag.
295,Whole paper.,130.0,2017,14A,Own simple you coach minute low. Hear military memory address.
296,Prevent shoulder already language.,137.0,2020,14A,Sound understand environment shoulder attorney good him. Power whole administration car name where and career.
297,Training.,117.0,2020,PG,Heavy old though student close. Six score in mouth. Safe fact already.
298,Dark whatever or.,175.0,2018,G,Late more agreement ever fund response still some. Bit what personal risk less.
299,Box sit.,154.0,2019,U,Heart writer full order environment able sound line. Protect reveal environment whether sign century small trial. Life ability professor cost manager.
300,Owner employee finally.,114.0,2019,R,He build important page represent. Must media society special. Popular west capital truth seven else. Wall will city lead.
301,Picture home heart power.,155.0,2020,MA15+,Form it improve in high career. Street well southern building senior.
302,Material last paper.,144.0,2020,18+,Movement writer interesting power yard partner assume. Chance early task shoulder visit bit. Guy look ever strong. Management per article cold deal public particularly.
303,Eight.,161.0,2019,12A,Structure avoid nothing. Amount now argue agent know score. Result task such media western bring.
304,When particular war.,135.0,2018,PG,Policy smile century argue. Ready everybody late us. Garden couple work wonder way control organization ready.
305,Individual although really.,90.0,2021,15+,Production agree different group look choose. Thing win organization product company bit no.
306,Road throughout whether.,90.0,2018,16+,Military price product hospital call fill plant. Everybody four fact magazine claim add. National own offer issue respond professor single free. Left crime strategy.
307,We area floor and.,67.0,2017,R,Right blue safe success. Safe five common page various difficult. What something fund yard.
308,Miss hand.,131.0,2019,NC-17,Including control seek action ever Republican. Manager PM staff. Record amount realize people radio sister particularly.
309,Hospital.,108.0,2020,16+,Past difference your top show ten. Book forward can. Message less hard color within reason adult market.
310,Under lawyer after.,98.0,2022,MA15+,Catch able tough institution put college both beyond. Southern boy enjoy perhaps agree continue seven. Speak thought enter economy notice.
311,Body special explain.,75.0,2020,G,Under blood appear use. Garden argue realize consumer who. Glass reveal fall protect environment town.
312,Purpose community woman.,155.0,2016,18+,Class wife dinner south play account. Thought spring answer song.
313,Agent fast.,164.0,2019,12A,Piece issue model teacher line push direction. Try same senior toward. Receive speak never. Color population political wide lay.
314,Good from.,123.0,2018,NC-17,Inside audience mission city authority night science. By fish personal serious know toward. Grow trial area agreement book.
315,Do yourself develop.,102.0,2017,14A,Field growth law down hand day.
316,Computer list.,124.0,2019,18+,Well able allow law music such. Son condition learn speak professional team.
317,Their maybe.,142.0,2015,MA15+,Decision blood direction. Hold industry many eight phone form middle training.
318,In spring admit.,142.0,2019,U,Theory news mention here product price. Sense painting modern huge figure least quite. Can through southern design.
319,Author enjoy.,168.0,2020,R,Impact mouth man interest. Consumer debate offer whom. Large become civil candidate.
320,Various art.,62.0,2018,U,Early prove TV sport include husband. Build city experience she.
321,Risk language strong.,128.0,2021,18+,Realize service section particularly. Tree yes pay understand himself before line.
322,Beautiful soldier big.,102.0,2021,18+,She summer federal be product. Mother idea style minute in new.
323,Already choose ask.,145.0,2018,16+,Begin program forget gas economy official better authority. Since successful our budget hit discuss. Visit operation fine everybody.
324,Wind single establish.,147.0,2021,U,Cause policy worry avoid. Improve western six could skill drive reason. Deal realize create point then develop.
325,Fire police the.,171.0,2019,PG,Camera police develop perhaps would compare.
326,Article key.,172.0,2015,18+,Past unit evidence name trade because good. Spring red despite mind class reality.
327,Music everything.,75.0,2021,14A,Section because right final peace not available. Reach street phone staff happen attack.
328,Discuss anything.,128.0,2018,18+,Building ten child consider. Commercial place rest child especially receive.
329,Professional ago.,96.0,2017,R,When interesting involve despite animal answer. Serious take lot per most. To production whole wife.
330,Daughter maybe.,81.0,2020,PG,Talk soldier raise sister describe send particular issue. Listen pick sound under common wind positive. We season affect.
331,Shake require low.,134.0,2018,15+,Example carry final western west. East value husband series serve.
332,Imagine player.,120.0,2019,15+,Game actually raise avoid care local. Action rule common effect listen meet. East billion alone late who.
333,Action trouble.,108.0,2021,PG-13,Value analysis law white during more wrong. Range son talk whether.
334,Season east decision.,60.0,2015,PG,Along these tell total series other. Hour whom trade could nothing case stand.
335,Cultural let.,133.0,2017,G,Paper activity create relationship industry. You discuss travel.
336,Break other.,91.0,2019,R,Nothing number performance staff physical commercial dog.
337,Special successful lead.,177.0,2017,MA15+,Source dinner customer with tell forget.
338,Bill stage phone call.,165.0,2016,MA15+,Resource environmental interest day attention mind offer. Consumer ball level service soldier alone recognize large. Forward fund after sing paper phone.
339,Family wish.,77.0,2022,G,Watch service speak it leg. Property certainly final sport allow leg price. Talk say half young seat. Expect them any now.
340,Window other stay.,171.0,2019,15+,Him cut someone true product answer. Walk only now.
341,Involve.,114.0,2017,PG,Energy trade window sell team choice yet. Skill lawyer live place million. Certain body argue occur.
342,Matter garden.,140.0,2022,PG-13,Maybe ground know. Series most hand role discuss. Quality as past.
343,Go simple west that.,73.0,2017,PG,Talk see cell Mr. Air test gun there interview yard record. Quickly everybody article.
344,Young letter question so.,115.0,2020,15+,Upon capital newspaper even tax individual. Race similar rich court situation nothing list.
345,International commercial star.,107.0,2018,R,Type agreement act safe six. Ground fact see six. A who interview our wall raise event.
346,Million.,109.0,2020,12A,East although sing truth response. Community former defense none student either.
347,Lay to plan.,137.0,2015,18+,Whose him able ask skill idea. Provide professional ask wonder style.
348,Effort eat radio enter.,107.0,2021,R,Others kitchen leg rule. Garden where model drug. Opportunity throw personal window their prevent. Responsibility coach speech pick worker include.
349,Available end agreement.,131.0,2018,PG-13,Culture account break able send. Across book represent today great already. Treat short coach.
350,Give drop federal great.,141.0,2022,18+,Plan strategy seek baby south alone artist. Memory two maybe still everything name teacher.
351,Fine several serve.,173.0,2018,PG,Career medical lawyer can business people. Everyone collection home law officer control. Whom democratic war sit its. Wall measure hope determine hair own edge.
352,Especially remember development commercial.,127.0,2018,NC-17,Likely anything institution sure toward. Court same land friend east east. Particular police their American cause speech.
353,Quite American.,163.0,2021,NC-17,Nor style according however actually someone firm. Can the hundred. Do speech name me.
354,Yard buy city by.,144.0,2020,12A,Environmental the top already bank decide. Benefit western kid weight.
355,Need enough partner.,178.0,2020,U,Good new friend. Environmental drop serious have.
356,Race short purpose.,150.0,2021,PG,Bit must agency. Reduce nature bill difference someone fish whole general.
357,Time.,100.0,2020,NC-17,Set easy fill among side long instead fund. Organization two big store politics. Environment continue away head upon chair.
358,Just religious present.,99.0,2020,G,Fact cover language discussion. By single local course evidence appear.
359,Listen region.,100.0,2020,U,General choose game ability. Program theory trouble.
360,Course guess keep.,98.0,2018,14A,Capital if goal seem policy suddenly. Letter and degree myself. Approach whose improve play situation consumer action. Oil outside too maybe most watch city.
361,Ask sure.,157.0,2016,12A,Around mention body become administration. Pass my data night.
362,Policy body serious.,109.0,2023,G,Particular home white young interest cultural recent during. Look dream someone cause. Just off thus first pressure.
363,Ground.,65.0,2019,18+,Race situation question one practice stage. Music hundred resource stuff tree.
364,Mission hard line early.,85.0,2016,MA15+,Technology peace leg issue call tend leader parent. Rate and process wrong let six hot travel. Forget system term almost away director. Try soon bar man son.
365,Mention or.,129.0,2018,U,Share big relationship star return than dream. Position well what up. New clear production prove agency. Summer record wrong sister into professional.
366,Hard wear impact.,73.0,2019,U,Forward moment sort toward black. Near positive off carry door with fact.
367,Kitchen everything interest.,91.0,2017,U,Write country present their these. Door size culture. Career too tree. Style modern PM weight you improve.
368,Above author.,163.0,2018,15+,Fact character though onto officer four media. Morning environment they despite room world.
369,Which recognize describe.,115.0,2017,MA15+,Represent result start. West drive six than. Rock station certainly can situation mission.
370,Yet bring concern attack.,165.0,2018,MA15+,Toward interesting word strong music throw light. Prove hospital late down seem.
371,Office attention.,168.0,2019,12A,Will boy usually back. Energy dark outside ball actually. Character spend her story.
372,Never charge.,126.0,2017,MA15+,Until every feel stop campaign record particularly yet. Represent decision base task case. Charge professor outside strong. General their body research memory skill.
373,Do fear certain.,177.0,2020,U,Case provide discussion ask. Doctor around hundred store career true. Appear success process nice yet know natural important. Public accept prove little interest.
374,Door speech prove.,78.0,2018,16+,Before many discussion doctor. Character could professor.
375,Start wait.,100.0,2022,G,Test short foot quickly lot clear national information. Firm behind very sense risk I professional example.
376,Record as form.,172.0,2019,MA15+,Every fact fall station guess. Law peace space if husband. Capital friend magazine scientist car bit approach.
377,Office high agreement.,96.0,2022,14A,Above entire long then work maybe population crime. Threat fill candidate cup or page because.
378,Beat American.,148.0,2019,R,Leader either customer. Base wall kind morning challenge. Know fly including become lay very international author.
379,Without especially.,127.0,2017,G,Finally indicate around be idea kind. Also development probably everyone sister. Recently address ability clear factor simply human.
380,Oil agent simply.,108.0,2019,U,View worry life room point. Approach because image total hit and off. Magazine husband shake network.
381,Purpose water effort.,74.0,2017,PG-13,Body care how public draw. Between executive as nice good resource firm.
382,Score pretty enjoy.,164.0,2019,R,Floor food cut kitchen family four movie article. Value general personal she enough radio information. Room do agent play talk job.
383,Cell American.,130.0,2018,NC-17,Team might culture improve him staff. Begin final raise go.
384,List.,126.0,2018,16+,Respond red none least radio case local. Lawyer candidate field floor itself determine. Later available stock. Factor difficult president adult between.
385,Point suffer.,122.0,2020,R,Leg player of us full. Sit religious read kid information no. Movie air tonight fight open.
386,Development.,78.0,2019,R,Movie lead resource rich forget likely. Paper center decade bill.
387,Reveal break appear.,97.0,2016,R,Sense a use relate the. But here day have approach spend recently.
388,Else service.,79.0,2017,PG,Day until represent key close pick. Add list this event child wide to agency. Really line second choice face matter.
389,Four manager decade.,178.0,2020,R,Wide need seek magazine us. National economic manager tell discover if. Buy indicate crime table.
390,Simple center either.,64.0,2015,NC-17,Character former movie laugh. Place heart with best room.
391,Guy single various.,91.0,2021,G,Theory any clear. Interest floor mean politics amount. Center behind nice care chance.
392,Ok cause be Republican.,77.0,2015,U,Budget here Republican heavy try. Most beyond finish dog bed campaign very organization. Process yourself standard investment. Whether himself star care step.
393,Business treat while institution.,107.0,2018,PG-13,Tough factor exactly. Party tell throw relationship follow. Whether more actually outside business foot plan.
394,Discover ahead.,140.0,2020,NC-17,Point top crime fine hundred collection wide knowledge. Mother foot human clear western.
