filmID,title,duration,productionYear,ageCategoryName,filmDescription
1,Four five.,84.0,2016,16+,Nice picture against push pattern opportunity project. Cold occur fund despite much return.
2,Fall build.,78.0,2019,16+,War various human wait. Letter story no.
3,Ground cell door.,118.0,2018,16+,Everyone begin others head. Reach visit dark dream seek. Social house success investment summer sense cover spend.
4,Authority center consumer.,60.0,2019,U,Exactly assume service low whatever politics response hard. Energy believe majority. Let kitchen safe approach century by.
5,Over however.,117.0,2017,18+,Old positive force recently meet north science. Improve general show leader cost carry range. Bed whatever knowledge style American Republican leg individual.
6,Sister there.,100.0,2018,U,Run morning control voice social. Manager responsibility receive west only.
7,Off top.,67.0,2018,PG-13,Author time really good brother. Food catch away whatever.
8,Where cell model respond.,109.0,2017,15+,Resource set institution edge bar everything buy reduce. Author pattern chance blue develop again represent.
9,Difference model program.,78.0,2022,15+,Against network community. Offer statement end hit cost energy receive. Might few both behind Republican finish while add. Beyond final public.
10,Human wonder.,113.0,2016,15+,Let respond audience college similar trouble. Either their owner evidence young. Her enjoy matter.
11,Marriage full him.,179.0,2017,G,Continue sell ok star far foot. Factor save lead window law.
12,Over bag sign.,73.0,2018,18+,Report including why social as. There first respond challenge think.
13,Paper everybody.,140.0,2019,MA15+,Set election official read. Figure whole attack increase research. Shake very short film.
14,Pull show.,103.0,2022,PG-13,Yourself face beautiful her board majority. Meet side remain although. Hold fine relationship may.
15,Author plant together.,113.0,2015,15+,Yes reveal lawyer. Treatment message before. Whether time thought north religious where international.
16,Discussion hair here.,150.0,2016,16+,Senior realize evidence stand process. Value wonder store also. Table recently mother.
17,Work should.,149.0,2016,MA15+,Decision candidate security however. My each none assume. Small network audience clear.
18,Fine that.,134.0,2020,G,Game authority increase every gas couple. During technology kitchen bag. Nation thing travel support head consider.
19,Exactly road.,101.0,2022,PG,Partner city store nice find these. War final easy today life hold strong.
20,Teach fly.,102.0,2022,PG,Particularly quality figure conference red show poor. Even level explain indeed which fine exactly. Issue reason story assume much interview green leader. Employee security key establish president.
21,At main national.,102.0,2015,PG,Message contain allow teacher property. Share year question.
22,Major edge around because.,88.0,2017,MA15+,Close night they bag indicate stop happen letter. Particular population oil fire shake.
23,Crime station easy.,92.0,2021,NC-17,Seven nation way each page already information. Treatment maintain energy do use phone.
24,Before agree rather.,95.0,2018,16+,Training quite store. Board teach skill table visit front somebody. Well suggest concern politics discuss.
25,Project bill.,118.0,2019,MA15+,Focus skin people gas. Eat tend design memory think true act tend. Strong series likely discussion.
26,Item to economic Democrat.,105.0,2017,MA15+,Off certain five. Indeed seek his return figure cause point improve. Suggest buy throughout.
27,Factor forward loss.,79.0,2019,12A,New air into have true respond force. Able may customer but grow meeting image. Tend or better know baby.
28,All word skin.,76.0,2018,NC-17,Foreign quality him. Ago letter policy identify. Common standard over professional.
29,Fund alone outside relate.,140.0,2017,16+,Positive tell source teacher. Only key tonight hair answer.
30,Marriage call next.,128.0,2019,16+,Law notice east receive. Cell wear water end.
31,Point role draw.,136.0,2016,15+,Perform the bit run agreement. Summer grow fine short hour assume. From movement picture clearly.
32,Teach involve technology.,179.0,2018,U,Agent themselves nature investment.
33,Current.,175.0,2020,PG,Share capital begin during choice. Wind reason article turn. Like treatment seven seat pattern.
34,Deal.,113.0,2018,18+,Building staff always make realize. Require message approach glass respond foot. Development somebody commercial care off enjoy.
35,About analysis race.,97.0,2017,15+,Dog special institution campaign arrive. Shoulder entire voice benefit agree prevent out.
36,Standard try cultural.,140.0,2018,G,Whom back anything series hold these. Century start law marriage may probably change. Ok any particularly hope collection pattern.
37,Day Democrat.,97.0,2016,R,Factor include lead ahead long. Mission national source stock building of hundred.
38,Concern.,161.0,2015,R,Mr our style answer west teach floor. School room market however collection why. Until oil side maintain soldier wear.
39,Subject significant brother.,75.0,2017,18+,Without yes because give never fly well.
40,Much listen.,116.0,2022,12A,Political at great executive trial method campaign modern. Light left their attack me.
41,Group age.,62.0,2018,12A,Character read white wrong. Look hotel hope benefit.
42,Situation see seat.,100.0,2018,R,Though hear affect. Act call will pay attack conference become campaign.
43,Sister news share.,171.0,2015,R,Or she turn improve one structure around. Threat who natural check concern especially.
44,Degree operation.,154.0,2019,18+,What administration three difficult city cultural reduce. Possible everybody sense place something.
45,Focus attention.,154.0,2019,16+,Meeting simple fight whether visit guy. Spring plant manager step. Investment price mean child yes message Republican professional.
46,Power character.,93.0,2018,NC-17,Character look hold beat crime sit. Everybody or back true each purpose.
47,Wait admit finish.,144.0,2020,16+,Color staff class sometimes while particularly or growth. Worry year beat degree.
48,Significant we.,170.0,2020,G,Authority form city.
49,Leave first whose.,62.0,2017,PG,School like find oil. Investment somebody do. Edge skill involve second note.
50,Admit order.,81.0,2017,U,Hold father prepare everyone through. Visit visit science kitchen budget. And many state my still move.
51,State hear international remain.,82.0,2019,U,Trouble some difference skill. Newspaper third line something.
52,Could suffer only.,101.0,2020,18+,Peace ability training one partner drug debate. House type political plan enough know himself. Set before short.
53,Yet leader spend.,134.0,2021,15+,Particular wear beautiful race number. Trip east dream task bring tell call.
54,Official clearly.,153.0,2018,MA15+,Significant upon sister may effort during radio because. When need newspaper firm choose medical. Put figure worry crime draw personal.
55,Keep kitchen theory.,125.0,2018,NC-17,Reach stock store attorney term seem. Lead relate they way. Appear arm foot might test. Night hospital effect building author fund strong.
56,Movement somebody go.,180.0,2016,15+,Through president no leave. Eight there western compare couple. Every because several land.
57,Meet buy.,150.0,2016,MA15+,Scientist then dark upon provide everyone wear. Student catch development same guess friend international. Happen worry pretty really. Effort decision dark entire avoid science partner.
58,Herself establish card.,114.0,2017,NC-17,Knowledge move find describe model drop after. Campaign husband be.
59,Everybody environment reflect out.,168.0,2019,PG,Security thus detail member. Name realize story international. Of appear same theory resource will month.
60,Foreign check.,75.0,2018,R,Truth change year style. Keep look wind share.
61,Election three agent create.,89.0,2020,G,Sound population information probably community theory place. Save voice somebody officer accept particular reach. Low become drug trial may son.
62,Hotel there resource.,146.0,2017,G,Idea within government child upon real exist. Final dinner issue enjoy party television.
63,Popular everything.,164.0,2018,14A,Common item people could bar. Practice bill real issue central.
64,Southern.,81.0,2021,16+,Every or door political. Next page different age democratic she.
65,Question become energy.,159.0,2020,MA15+,Friend PM not run before individual. Or fall admit difficult. Might speech after develop language. Southern letter above music plan.
66,However glass guy.,142.0,2017,PG,Current also sister place store yes who.
67,Either western per.,166.0,2018,PG,Dinner will whom writer every human. Join hear free before. Challenge image each become debate certainly own.
68,Indicate can high me.,100.0,2018,NC-17,Visit lead agree keep check issue name read. Kitchen somebody appear race. Health body current service apply.
69,Goal skin teacher.,156.0,2019,U,News dinner whole option. Financial role along sister. Only some politics.
70,Both act.,130.0,2018,15+,Perhaps class range. Market glass huge door structure raise force. Skin reduce stock window director food coach.
71,Owner security so.,138.0,2020,R,College because nature until. Nice study bring catch.
72,Team.,82.0,2016,G,Quickly light remain mouth. Under travel sort keep. His walk building. Whom everybody operation result beat sign agent claim.
73,Itself.,175.0,2017,16+,Leader nor tend doctor camera. Suffer station financial blood still. Born almost stuff trip.
74,Field him.,151.0,2019,MA15+,Small good tell phone. Top ability box charge school as. Republican black memory. Fear build beautiful likely under argue traditional.
75,Main stop.,93.0,2020,14A,Idea name clear maintain view relate decade him. Lose understand natural born the be police.
76,Life commercial team.,141.0,2021,14A,Far serious increase watch affect reflect left learn. Size theory floor late throw design arm.
77,Marriage coach.,126.0,2016,18+,Specific deep street your none. Image participant five four war relate. Important movie according individual. Remain laugh guess art call certain.
78,Down include knowledge act.,92.0,2016,U,Culture economy build there professional notice. Base pass goal standard while most. Civil part whom answer.
79,Note decide can.,82.0,2015,12A,Book effort worker since face news turn. Control another rather participant successful decade. Join offer natural shoulder time north among to.
80,Make carry development work.,94.0,2020,14A,Star say usually bad worry sound have. Late morning wind make break begin.
81,Impact reduce address environment.,85.0,2019,NC-17,During city forget free book seven color wall. Appear analysis truth movie arrive. Heart heart record option subject.
82,Since town spring.,126.0,2018,18+,Picture whole job quickly skill. Later ground generation happen weight.
83,Billion.,165.0,2018,R,Identify clear stock him five factor. Management politics staff property within relate. Rich involve energy serve traditional stop although member.
84,Among size avoid.,147.0,2015,18+,Job who face onto American woman boy. Condition simply example issue. International source large attack business anyone improve.
85,Pm.,145.0,2022,PG-13,Argue Democrat meet heavy fall. Responsibility around individual usually perhaps same career. Lead number respond stuff west wait throughout.
86,Rate summer thousand.,74.0,2022,18+,Couple share should head choice. Heart line body out hear. Turn hour design.
87,Guess.,158.0,2019,18+,Choice store knowledge economy able half. Officer despite notice local show.
88,Year my hospital.,138.0,2015,14A,Speech foreign defense north war. On page adult require fight stand music. Guess individual year lawyer.
89,But issue.,145.0,2018,14A,Fast after establish. Beyond lawyer middle by. Middle about major food unit land.
90,Federal name age.,170.0,2018,PG-13,Appear program medical drug. Product organization sort ever two.
91,Ten.,152.0,2017,R,Whom long probably himself state.
92,Election lose modern.,106.0,2022,G,Lawyer discussion continue film financial right. Economic simple education tonight her business put.
93,Will collection.,108.0,2016,G,Newspaper ball full late. Yet somebody leader organization group.
94,Garden party.,171.0,2015,18+,Agree or opportunity according page soon. Prove culture western choose.
95,Agree buy.,146.0,2019,16+,Put provide easy television beyond hot. Nation next air cultural. Executive owner usually accept event defense Congress.
96,Keep within actually.,132.0,2016,PG-13,Buy first visit then color world. Democratic purpose fall mission rise political nature. Assume condition school benefit whose.
97,Take stand.,138.0,2018,G,Focus suddenly deep yeah. Offer break indicate learn break few since. Level happy yes record life sit.
98,Bill plant.,143.0,2017,MA15+,Executive debate bar see collection as. Stuff ever at. Site responsibility style law hotel such. Purpose dream want affect.
99,Nature approach.,135.0,2020,18+,Herself husband see fear particular. Write big with evidence.
100,Civil guess per.,107.0,2021,MA15+,Would collection prepare property economy page. Know outside high good store spend shoulder.
101,Interview after sometimes.,129.0,2017,18+,Exactly visit far forward arrive. Mrs new your speech method garden month but. Debate performance two ahead. Range mother prove challenge in start.
102,Girl view.,157.0,2018,18+,Interesting make area natural. Give word husband company.
103,Organization.,173.0,2019,MA15+,Enough strong threat two yes. Beyond reveal budget central property loss. Evening build window determine network full past.
104,Future agent.,82.0,2018,14A,Much whatever arm understand general cell organization. Risk treat popular degree small scientist red size. Drive throw check foot.
105,Play red others skill.,109.0,2022,12A,Want project total try. Enter start wear machine address fund mother. Great treatment responsibility personal.
106,Can especially middle.,169.0,2020,14A,Minute collection stand approach weight base.
107,Group production.,124.0,2020,U,Eat current federal.
108,About method Congress interest.,116.0,2018,PG-13,Democratic safe through range front house. Product when outside child garden clearly season. However remember team key.
109,Reflect week.,114.0,2020,PG-13,Issue after main effort culture mean. Growth forward same so.
110,Bad design establish.,83.0,2020,15+,Not wrong can who who shake wear. Defense protect add operation who great analysis. Miss case though pick.
111,Performance like yeah.,112.0,2017,R,Grow along performance modern these summer sing. Smile budget develop education still.
112,Country fly to use.,151.0,2016,14A,Management people Democrat option catch well. Look wind eye any high goal stage.
113,Major statement however in.,167.0,2017,G,Born allow project for. Arm official management why.
114,Ago hard.,96.0,2017,12A,Eat vote something for physical ago win. Dream issue lay summer.
115,Before build.,126.0,2020,PG,Up seek continue ready. Foreign sense machine share people each early. Tell car economic activity student brother.
116,Need process store.,173.0,2019,U,Generation what shake begin. Issue finish thing left.
117,Crime hundred.,127.0,2016,MA15+,Serve account science with sort drug.
118,Choice.,143.0,2019,PG,Little century class family something player.
119,Senior past lose.,101.0,2018,18+,Thought reality decide fact language. Part character democratic its social night economic.
120,Century.,116.0,2016,R,Never table we carry responsibility chair. Doctor analysis treat plant list point money. Develop growth parent economy.
121,Ball cup.,103.0,2023,PG,Quality when machine instead difficult. True plan music score production officer people chance. Perform sense chance movement can activity smile.
122,Art history site red.,158.0,2019,15+,Number under range face open. Lot practice movement answer. Bad buy picture test.
123,Resource.,95.0,2019,MA15+,Subject what before authority address find. Prove open board attack just street morning. Game allow like around suffer.
124,Government finish.,130.0,2019,U,Hour ago firm. Four expect begin free modern success. Tonight seven learn smile. Space politics financial against.
125,Practice family.,155.0,2017,16+,North be down arm leader. Surface determine purpose course month director after the. Sing blood natural.
126,Term put.,141.0,2018,18+,Letter early theory. Social yard on nice up.
127,Number color.,88.0,2021,U,Positive far player poor oil realize. Evidence accept lose statement. Entire apply today hope.
128,Pattern tax.,100.0,2022,14A,Subject stock continue position. Nation travel truth under federal single them. Each action put event forward couple. Me production note check car.
129,Thousand.,136.0,2017,PG,Claim could yeah spend keep actually near. Follow mind a economy and.
130,Increase choice.,164.0,2019,PG,Fund already administration pattern sport. Water network education resource know indicate.
131,Brother including he.,64.0,2022,MA15+,Serious spring growth I. Early college read rather agree five. Poor head too.
132,Stuff.,160.0,2021,16+,The lead room foot admit tonight look. Inside pull start. Fill vote main have poor continue. Detail from say college scene.
133,Receive sort.,120.0,2019,16+,Beat anyone home west. Play address our agree. Clear adult edge building election teacher do authority.
134,Fund become teacher.,169.0,2023,12A,Particular girl trade. Player both bed your road everybody whole. Between ask school care.
135,Though hour their.,126.0,2022,G,White office worry create draw. Consider improve we nice old glass.
136,Lot public citizen.,115.0,2018,15+,World blood week sing. Sit their either language sort best national. Free teacher factor scientist determine.
137,Leg short.,99.0,2020,G,System everybody baby space. Office marriage individual receive.
138,Red including city.,81.0,2020,PG-13,Per accept head probably product. Education drop most food myself soldier. Treatment onto fall pattern camera begin effort could. Tree natural get page.
139,Fight general expert.,130.0,2016,15+,Answer establish finally manage hospital activity and report. Although use campaign include news affect rather.
140,Establish black meet.,106.0,2019,15+,Cold once next. Modern position spring cost certainly. Join sure weight source however they we.
141,Student fact.,118.0,2021,15+,Size century study herself us might star. Car fill the student fall successful high. Include drop game. Six help behavior decide onto rate table.
142,Wonder pull water.,166.0,2019,G,Speech child institution yes themselves present beat. Author approach provide nature art media. Game per hand fill management my.
143,Together.,171.0,2021,U,Myself enough situation begin enjoy why wind fund. Board national region whole once.
144,Bring office certain short.,106.0,2020,PG-13,Address toward father bag bad federal. Avoid total thousand class material.
145,Medical table deal.,125.0,2018,14A,Human feeling need. Couple product arm she human future early.
146,Situation each.,110.0,2019,U,Here difference poor high. Give may among Mr reflect into.
147,True red central.,106.0,2022,NC-17,Much plan specific indicate avoid pretty. Miss agent need determine. Think sign claim eat own.
148,Partner drug dinner.,155.0,2020,18+,Could herself list town remember late push radio. Affect occur personal current offer left product always. Stop exactly performance hospital turn investment term. Beautiful coach decision low them lose such painting.
149,Evidence half.,109.0,2018,PG-13,Magazine thank mind pick. So yet at ahead may. Police produce lawyer process common local probably read.
150,Can protect.,128.0,2015,18+,Despite pattern where glass treatment cell. Foot main especially during play less issue hope. Room information doctor relate.
151,Success religious just property.,123.0,2018,16+,Write once very animal. Campaign third mention head. Base nation respond life full.
152,Actually the may though.,177.0,2019,R,Third effect red choose.
153,Young general become.,173.0,2018,G,Fast movement factor minute. Lose indicate but movie difference. Perhaps pull full theory rule show.
154,Hit notice.,80.0,2021,18+,Forward ability situation American at yard do. Reach past could after else require.
155,Section stop either.,86.0,2020,G,Yet miss federal business community.
156,Pass.,78.0,2021,12A,Onto how fall accept record might. Effect only fast TV per friend ability. Concern guy parent agent across design human. Maintain fact pay old picture must factor.
157,Room meeting too.,60.0,2019,NC-17,Table five arm economy big name appear. Material former present.
158,Arrive technology conference.,144.0,2020,G,Every operation final high sort Republican appear. Least leader career begin produce. Present issue win read particular second.
159,Be.,80.0,2022,16+,However few three shake. Try answer study fund cut. We state woman night TV.
160,Phone choice smile.,102.0,2016,R,Exactly continue for well music. Somebody take political probably. Race air race history drive.
161,Kind yeah.,94.0,2021,G,Research at last amount. South pass give hold arm coach in.
162,Opportunity whole save.,101.0,2019,16+,Available dinner say trip. Value provide front. Sport however executive throughout night.
163,Central nation.,104.0,2019,R,Perform home set. Above sea contain rock.
164,Stop include personal land.,170.0,2019,PG-13,Front discussion simply energy career nor. Easy activity interview fly keep attention where. Next success society long.
165,Reflect now.,138.0,2018,14A,Road first she those set threat. Expect language through common similar other whatever.
166,Town generation.,119.0,2017,PG-13,Quite responsibility though move back. Long also reveal nor lawyer instead difficult. Clearly parent sure nature analysis style full.
167,Across cause property right.,112.0,2020,18+,Interesting event the him southern. Than while daughter follow stand note event about. Defense ago receive American.
168,Successful style career.,140.0,2018,14A,Good prevent soon stage movement call can water. Task within particularly study a.
169,Letter follow.,106.0,2018,18+,Risk easy country realize represent hear. Heart be seat affect blood consider take.
170,Change surface his.,156.0,2022,PG-13,Song company head. Offer more base listen. Region race point pretty say behind instead interesting. Budget away provide study return small.
171,Need budget human account.,168.0,2018,U,Way hot decade. Important head imagine you past.
172,Along today various.,98.0,2019,MA15+,Without husband determine during generation good left.
173,Year.,136.0,2021,R,Account above thus. Wait argue free produce by especially follow. Billion commercial cold candidate key.
174,For nearly.,161.0,2018,U,How run would little difficult could. Television natural try how I store old. Everybody scientist put mother.
175,Program through.,104.0,2015,18+,Stop question less type yes all lot certain. Would word camera easy pattern mind she. Authority thought those under spring large traditional.
176,Image event trade.,63.0,2020,16+,We truth since whether soldier participant. Development several give accept. However listen join early laugh window social.
177,This result.,121.0,2019,U,Than director environmental training method. Live only character according. Say Republican line guess record space.
178,Leader hair simply.,91.0,2016,G,Talk page recent cut easy. Great nothing sound card try air. Behind financial north form. Set president protect morning seem else walk.
179,Hope room choose board.,75.0,2019,NC-17,Education know experience business can feel spend. Billion these someone under human. Red same along what resource.
180,Dream wife behavior man.,129.0,2019,PG-13,Shake rule color learn worry purpose anything though. Item enough answer factor performance red study. Fight kind whole eat. Report forward own apply pass system.
181,Those news.,156.0,2021,G,Hear have of show red American coach seem.
182,At race south.,156.0,2019,16+,Hot action choose imagine base movement policy.
183,Ten structure part.,164.0,2018,15+,Interview say risk throw theory. Authority yet drive action improve result democratic tonight. Move production ahead across.
184,Debate coach represent east.,146.0,2021,G,Son son seek team debate standard worry easy. Investment consider really six dog statement town.
185,Race own.,163.0,2017,MA15+,Local level system happy early want. Movement court everyone Mrs thought bed indicate. Southern home impact prove no appear everybody challenge. Tend apply she.
186,Morning oil.,99.0,2017,16+,Benefit book before action ok. Leave challenge player focus teacher.
187,Way.,169.0,2019,NC-17,Can factor financial paper yet read skin. For catch worry cell. Inside article matter report scene college ok.
188,Least almost.,169.0,2019,MA15+,Forward whose guess all often thus. East generation happy. Step land hard situation action first.
189,Lose become.,119.0,2018,16+,Example actually happen although list yes answer score. Energy police relationship expert.
190,Into black movie.,147.0,2018,G,Of month grow game floor. Color simply on finish place maybe. Network bill reality many bed.
191,Treatment possible.,103.0,2016,PG,Model that resource significant meeting interview worker. For can work inside parent a.
192,Example character.,69.0,2018,NC-17,Outside hear hot buy tax size. Treat prove finish young popular believe trade.
193,Say talk.,178.0,2017,U,Serve easy sort response draw. Financial teacher car. Pattern page price base necessary white toward.
194,Effect race music.,172.0,2018,MA15+,Sound just attack region throughout performance. Military its way page analysis theory response employee.
195,Read.,114.0,2021,G,Early night evidence keep nor. Consider throughout ball message. Newspaper report key what positive support our. Head indicate environment second strong decide fill.
