filmID,title,duration,productionYear,ageCategoryName,filmDescription
395,Speak now produce.,173.0,2020,16+,Real catch course voice. Just remember school down attorney if purpose phone.
396,Remain should race message.,151.0,2017,NC-17,Ago guess contain list find. Read amount what despite board dog deal fine. Station such within leave live.
397,Join economy hour.,104.0,2020,G,Than place suddenly those foreign nearly major customer. Federal pull message ball right sure training.
398,Power save maybe.,97.0,2022,PG,Daughter value situation film Republican job study sure. Personal word society strong. View base effect site clear. Require cultural impact word south.
399,Finally trial measure her.,171.0,2020,MA15+,Goal decade control far fish become. Middle public ability notice worry decade. Type hit rich agent.
400,Action.,178.0,2022,PG,Smile her front significant stay reality poor. Near near board.
401,Imagine officer.,112.0,2020,NC-17,Good skill herself. Drug fire later point whatever.
402,Bill sister common.,176.0,2019,MA15+,Resource summer air plant clearly. Help investment method better also possible end image.
403,Us include maintain.,68.0,2018,MA15+,Citizen day factor beautiful model class. Decade box would mission character for set. Team off foot go drug beat soldier shake.
404,Almost yes seek.,145.0,2016,PG-13,Early do such.
405,Reality enter color.,150.0,2022,15+,Gun like drug clearly effort. However great scene range.
406,Material on public.,98.0,2018,18+,History community entire news leg. Cost worker oil inside between always need. Career mention water education.
407,Weight smile mind.,62.0,2019,16+,West newspaper animal letter within article serve.
408,Public visit they truth.,85.0,2021,15+,Those system wrong us newspaper. Friend usually the peace arrive. Community middle American phone mean course. Those pull dark continue.
409,Still lead any.,98.0,2019,12A,Film onto note. Provide Democrat grow establish bag.
410,Yeah which.,143.0,2021,15+,Dream authority side dinner suddenly action discover your. Activity star space out probably identify. Bad see need between necessary.
411,Area.,73.0,2020,12A,Find news cut common watch. Feel say analysis positive simply development. Quite number exist open.
412,Send responsibility behavior.,153.0,2021,NC-17,Real teacher executive effect where couple then. Degree water sport my rather money official.
413,City will attack.,120.0,2016,U,Safe table money much. Nice fly dog care.
414,Whom sense news.,146.0,2021,U,Very enough degree civil bit. Meeting both still talk. Knowledge wait ask month.
415,Girl.,156.0,2021,18+,Heart compare would tree sing can single. However join consumer week skill hotel. Day after beautiful factor material cut young.
416,Professor former.,74.0,2019,U,Level arrive particular seven arrive upon accept. Run and particularly mother current state baby. Avoid month reason series word interest. Ahead role down morning investment herself listen.
417,Direction medical.,131.0,2015,14A,Today quite live physical individual. Main call word whatever mouth imagine. Always resource table Mr purpose save nor possible.
418,Central statement.,98.0,2016,G,Live guess discuss responsibility help economy major study. Heavy baby board especially late seven.
419,Range black.,138.0,2021,G,Easy west that democratic off.
420,Girl never answer.,98.0,2019,NC-17,Someone pretty resource garden remain say. Per similar above.
421,Let beautiful.,72.0,2022,G,Up seek skill reality actually more partner condition.
422,Identify business.,82.0,2016,PG-13,Sell movement some rise. Series base fear control federal enter sense.
423,Including tree activity.,129.0,2015,18+,Small you someone need wide pick choose. Feel everyone notice me ok color right walk. Big left beyond institution.
424,Money bring culture together.,86.0,2018,NC-17,Behind but determine less eight clearly technology foreign. Fight national above science detail focus. She paper entire scene analysis grow opportunity. Test paper take amount soldier.
425,Side number.,129.0,2015,14A,Serve actually follow agreement pay. Establish third treat back we go region.
426,Those high.,174.0,2020,PG,Long determine represent share old technology. Shoulder shoulder fill improve. Next over administration.
427,Night as local.,154.0,2020,18+,Budget place never play painting which. Someone area will change film.
428,Southern now.,151.0,2021,PG,Huge control recognize argue. Husband source society.
429,One imagine.,69.0,2017,NC-17,Call fear must group care. Home job own deep friend.
430,Analysis nor.,81.0,2020,G,Blue against step.
431,How so.,77.0,2022,PG,Clear especially least guy. School system from out majority how.
432,Well option.,70.0,2018,18+,Training population between certainly at road. Hope place walk natural.
433,New send cell.,129.0,2016,G,Fall work turn. West source me stage.
434,Evidence continue affect.,151.0,2017,PG,City our full everything computer however already follow. Ten local report child. Deep station chance end property picture course.
435,Those skin seat.,130.0,2016,PG,Ball free six area. Everything it arm method reality suddenly rate.
436,Dog hope determine sister.,161.0,2018,16+,Have talk second. Race main wide eat TV. Rise society information.
437,Age still budget.,61.0,2018,PG,Beyond age picture despite day as sign rate. Tonight data along under old.
438,Economy enough.,141.0,2017,NC-17,Local draw line seem type right analysis. Any enjoy speak price dark history. Street decision near seek gas special east.
439,Eat.,163.0,2018,NC-17,Wait once with go follow history better. Great country different hope late. Seven teach concern.
440,Identify at begin.,149.0,2017,U,Walk increase dream pressure hit just send left. Ability low authority.
441,Eat husband make.,154.0,2018,U,Across building owner turn. Over treatment campaign past human all.
442,Interview truth reality.,64.0,2019,MA15+,Move deep although. Build give boy PM camera.
443,Choice red toward.,132.0,2018,12A,Prove matter even itself two food experience. Career wife series south these.
444,Admit real early.,99.0,2020,G,Speech soon weight know pick. Cost I onto cover exactly through state. Painting kind protect listen save role leave. Traditional thank participant on his pretty carry.
445,Magazine director loss.,112.0,2015,16+,Rather enough present main respond. End foot value prepare. Mention series community thousand young other.
446,Listen heart.,86.0,2019,PG-13,Yeah meeting really whole effort. Describe wonder test start issue spring. Law expect important best.
447,Produce trial book.,72.0,2019,16+,Coach certainly threat current by. Order direction cost movie.
448,Player life who.,112.0,2019,14A,Notice behind increase seven many table. Write ability group.
449,Care all who.,99.0,2020,14A,Glass call last. Lead itself happen check. Toward interesting mind husband should much actually.
450,Important professor either.,60.0,2018,NC-17,True piece Republican value. Away last him who science indicate continue certain.
451,Special maintain do.,78.0,2023,12A,Democrat audience decide loss school car reality. Along style either. Country day market tax example test short.
452,Environment professional.,84.0,2022,PG,Adult work social eat hard. Respond industry order edge.
453,Interview only lay.,160.0,2017,PG-13,Kind agency guess realize. Blue yeah reason clearly writer ball. Deep since them enter television represent.
454,Class maybe.,117.0,2017,U,White reduce class couple military color remember speak. Owner beyond quality program attorney admit because. Course if consider.
455,Manage push.,110.0,2020,NC-17,Foreign party other. Teacher very stop reach summer direction. Nor bed their product.
456,Pick news that.,119.0,2018,G,Resource meeting white approach type summer report require.
457,Travel yeah head.,118.0,2018,R,Example suffer protect let ready interesting sea leg. Morning whole adult style garden read. Establish ever present have ever. Bank piece side bag five current.
458,Eye civil chair.,97.0,2018,U,Top bill specific color professional. Shoulder official join but check century.
459,Hundred pretty.,127.0,2017,U,As send change relate talk step box. Interest rate camera million recognize different. Myself development only simply thus economic.
460,Example option move finish.,175.0,2018,NC-17,Manager which simple even. Knowledge computer use class perhaps happen produce people. Age design street last behind within.
461,Car develop.,143.0,2017,PG-13,Ability administration attention dinner commercial soldier especially. Economy within dog her suddenly.
462,Face.,116.0,2020,16+,Hit collection national material away plant audience. Industry scientist attorney somebody. Evening city onto computer writer speak attention.
463,Choice century.,108.0,2019,MA15+,Woman must line drug develop. Win most thought town. Fall account fish bad box dream.
464,Within thousand.,103.0,2016,MA15+,Certain body authority break ball find happen. Democratic must write exist father.
465,Local so.,112.0,2019,G,To you relate effort five. Reality rise build lead bit everybody week. Early ok writer kitchen.
466,Question TV.,166.0,2021,15+,Seat tonight know director writer. Keep day scene individual save hospital purpose.
467,Bit after relationship.,61.0,2019,MA15+,Send art national TV far. Time here almost on newspaper available.
468,Police trial.,90.0,2020,16+,Glass probably company avoid affect wrong. Item including wrong. Base include computer increase.
469,Clear talk will.,125.0,2021,18+,Bag human green throughout. Throughout business natural or prepare decision others.
470,Door term claim do.,155.0,2016,18+,City foot imagine night. Tree show remain garden share.
471,Become by item.,113.0,2021,PG,Her keep nothing data tend second still. Power father charge form. Low heavy land any.
472,End project though.,158.0,2019,14A,From speak mother really stop worry appear. Wear leave particularly item cup choose.
473,Until nature.,74.0,2020,15+,Spend the also field consumer. Box since despite news indicate know believe plant.
474,Team pattern.,144.0,2022,MA15+,Series recognize official. Stop anything care any person option would. School other central none purpose wrong particular.
475,High realize argue.,149.0,2018,14A,Collection describe build third moment a. Executive mention use wear few today. Smile ball issue major.
476,Possible rather member.,120.0,2022,16+,Everybody more lose. Point fly direction carry some experience finish. There how pick thousand adult side.
477,Effect follow.,136.0,2016,NC-17,Summer claim film window order determine. Too institution individual realize enjoy news. Society military work a.
478,Room.,85.0,2020,18+,Here see after individual. Watch player live opportunity follow. List kitchen already few whose tell.
479,Hot.,70.0,2019,MA15+,Project sing spend three include. Side worker if budget beautiful. Issue car key traditional.
480,Person street eat.,82.0,2016,NC-17,Talk there what five. Past point wonder serious them.
481,Door accept.,138.0,2018,18+,Language industry future production letter manager. Generation window natural tree dark any hit. Machine wide agreement outside yourself voice nor quality.
482,Mrs allow network.,77.0,2020,MA15+,Summer protect forward believe per true most policy. Present woman and message pressure business its. Her cost difference book think wide line.
483,Late might institution.,107.0,2017,16+,Fish surface most friend your dinner feel fast. Leg knowledge probably large likely property. Of many second seem wrong though.
484,Nature prove happen catch.,173.0,2018,14A,Consider need hit wish add. Medical compare write well these serious according. Until improve newspaper various recent now.
485,Mention development.,136.0,2020,G,Five really picture size foot become customer. Maybe experience energy buy close.
486,Section sing candidate tough.,171.0,2019,NC-17,Box body happen science religious second. Rich center crime physical moment building. As Democrat move career really way federal. Risk tell history a understand air form.
487,Explain.,118.0,2017,18+,Example thus step history foreign. Traditional then which action common lawyer professor everything.
488,Great significant former.,108.0,2017,G,Natural stuff physical for letter group. Model physical side movement manager ahead. Pull far take.
489,For market other.,169.0,2017,16+,Popular let lay PM remain his indicate. Final race political article. Reason town pay goal million.
490,Answer home.,117.0,2021,NC-17,Article capital capital certain light move. Gun provide land I not.
491,Answer risk history.,177.0,2018,G,Public watch red couple skin every. Deal technology feeling consumer writer catch say. Ready east issue compare reach.
492,Coach our.,165.0,2018,14A,Avoid us later. Rise reduce because operation.
493,Production at for.,180.0,2019,U,Minute newspaper fight never teacher despite. All wonder everybody say usually herself five represent.
494,Short bill last.,163.0,2015,PG,Very mean trouble current some. Reveal really situation wear each energy. Practice here begin should various inside.
495,Attorney cultural.,173.0,2018,PG,One we weight show movement hundred. Group floor summer blue common trade defense. Floor professional speech mouth music development.
496,Method establish property hand.,169.0,2017,PG,Detail style reveal soldier move. Way sometimes teach shoulder figure. Idea skin bill some draw north.
497,Say.,114.0,2020,14A,Save own step behavior good dinner.
498,Yeah main.,172.0,2020,14A,Several daughter reveal including rather road mention. Yeah stop notice reality. A security these sing poor. Section score eye example treatment popular me.
499,Form red.,97.0,2019,18+,Account create reach free successful sometimes.
500,Nation physical.,176.0,2020,R,Different down before reflect camera hand.
501,Arm despite.,99.0,2019,PG,Car audience choose difference focus stay forward. Building guy defense get. Soon whose smile sound cause challenge fear.
502,Shake common.,117.0,2017,18+,Send education future something bit. Young fund only deal similar style.
503,Fast.,141.0,2020,U,Card however call evidence our. Artist education economic go effect fire necessary. Forget fish meeting agreement purpose history project southern. Investment born structure if example western.
504,Role travel teacher.,84.0,2019,PG-13,Politics new visit skill. Forward win machine choose. Run type media spring. Describe determine relate whether.
505,Information alone cost.,143.0,2022,NC-17,It than magazine particularly. Defense hundred next only. Others center tax sense. Institution several crime more person series stuff administration.
506,Final yes tonight.,123.0,2015,R,Attorney right toward. Itself fall listen. Only language loss place memory important. North husband above our.
507,Ability sometimes.,132.0,2020,18+,Baby hot party message social sense author long. Program type what rather nation. News mouth fast rather mouth decide fire.
508,Nice save administration.,180.0,2018,18+,Today coach past large address agree. Since trip skin skill remember drive top. Member necessary chair all eye.
509,Save put degree.,151.0,2019,PG-13,Forward executive several play movie hotel TV. However bank plan idea water south but.
510,Central shoulder behavior control.,91.0,2020,12A,Likely field of relate spring. Yes senior station factor whose style through major.
511,Four can.,134.0,2018,PG,Form across no clear beautiful. Of game industry person interesting buy executive strategy.
512,Magazine eight.,158.0,2019,18+,Require involve threat final American. Cover minute inside commercial ever discuss. Learn budget writer continue.
513,Station project right within.,72.0,2015,NC-17,Talk hear fear. Quite part wife country. Home report boy mean from black. Boy responsibility us book.
514,Whole all.,151.0,2020,14A,Sort member police tree happen. Quality instead expect would. Believe society she candidate mean lot company case.
515,Race follow.,135.0,2018,14A,Lot big price television. Born always most budget.
516,Return.,104.0,2015,12A,Best realize because garden include money. Capital must evening tell issue record. Class me across people.
517,Low leave describe them.,115.0,2020,12A,Magazine effort road heavy speak look million. Upon image task professional happy expert.
518,Member arrive machine.,109.0,2017,MA15+,Plan song meeting it. Too above difference writer drive group.
519,Sometimes remember.,132.0,2018,MA15+,Account receive reflect range family sense. Want resource positive lose show interview without oil.
520,Concern.,65.0,2019,18+,Than science thought. Same quite decide national man mean ever final.
521,Too speech.,102.0,2021,NC-17,Receive baby country life. President follow ability road. Fight someone anyone general white.
522,Various possible score.,110.0,2016,MA15+,Western cultural before fight both suffer. Guess new current read traditional.
523,Admit.,140.0,2018,15+,International interest doctor career change listen.
524,What bit.,124.0,2017,15+,End exist husband drop possible one when. Nothing maybe place trip deal. Economic matter attention.
525,Study scientist.,61.0,2021,PG-13,Camera good else. Real dark international set ahead. Card bill seek stage.
526,Campaign also.,158.0,2019,12A,Would shake floor. Follow light animal director environment six.
527,Common herself total.,90.0,2017,MA15+,Likely local administration wide minute. Rule respond simply forget.
528,Majority plant season.,109.0,2023,PG,Book shoulder election bag red employee include. Against drop change find around send look at. Fly word determine station.
529,All involve generation.,171.0,2018,PG-13,Brother body table sound question response. Guess need pay spend college staff. Color receive by institution character happen without.
530,First surface.,147.0,2019,PG-13,Himself whom question official court remember country. End although future glass. Day arm smile employee meet choose.
531,Attorney protect.,119.0,2017,PG-13,Despite follow until may. Cell spend such partner conference turn.
532,Daughter organization claim.,177.0,2017,14A,Point poor different. Talk term manager smile tend boy ability at. Article happen whatever although economy film not.
533,Effect born.,66.0,2020,12A,Concern sea offer apply wide cultural seem. Inside west begin fish what.
534,Use.,100.0,2019,R,Inside hard make design my evidence. Relationship family action plant. Task upon shoulder purpose whole with adult.
535,Message that discover number.,130.0,2021,16+,Speech article everyone structure. Morning way management hotel easy agree you. Book carry small.
536,Result.,77.0,2019,14A,Century nor those. Difference important time hand trouble story stay. Whose glass training law detail.
537,Animal.,120.0,2019,PG,Almost clear around by employee.
538,Prevent yes.,66.0,2017,PG,When three low nation mind last. Suddenly mouth since some. Seat author expert defense responsibility major. Year three other mission.
539,Police person foreign.,99.0,2020,PG,Member lay through walk wear not. Common person set teach.
540,Sing move impact.,174.0,2019,R,Town section shake level guess perhaps. Environmental series house. Partner hour adult star national agreement amount player.
541,Ago expert.,70.0,2022,18+,Shoulder across practice water think. Address very lose mission.
542,Along.,110.0,2017,MA15+,Watch strong all huge success something practice professional. Interesting hospital reveal vote yard. More within ten.
543,Style big.,149.0,2019,G,High structure price reason. Author although step although whatever common better.
544,Hand American.,140.0,2019,U,Suffer apply painting break the network. Question camera give sell.
545,Under need table.,80.0,2020,PG-13,Here chance continue Congress administration herself size operation. Both will such budget half imagine long run.
546,Environment.,70.0,2021,18+,Hospital into exactly partner. Draw race defense. Guy successful election modern key ago.
547,Baby reason manager.,140.0,2018,NC-17,Past piece poor. Stand president while score. Election baby whom final.
548,Yeah law throughout.,95.0,2023,15+,Price economic draw treatment provide or blue. Similar attention stuff feeling.
549,Work could.,111.0,2017,NC-17,Buy minute again major. Join appear garden stand democratic.
550,Open cost of.,133.0,2017,MA15+,Sign wear follow responsibility. Pm free find central nature our mention. Include hear something deep carry.
551,Various life.,72.0,2017,U,Herself energy everyone set word. Get perhaps man.
552,House attorney catch.,72.0,2019,R,Organization ahead think research wear charge discussion. Run somebody I early participant. My similar officer it account brother.
553,Maintain decade surface.,87.0,2021,MA15+,Traditional particular TV huge do that very. More whose of front. Hold interest model.
554,Nearly project century.,117.0,2018,R,Rock movement nature everything push know. Reality show bank five society. Top less both year compare.
555,Share it.,101.0,2018,PG,Employee song growth organization forget. Finally center part suffer book serious.
556,Gas guy exactly role.,79.0,2020,U,Wonder draw meet quite bill pretty share. Inside because contain do series bill. First market knowledge maintain should.
557,Entire.,86.0,2019,16+,All democratic attorney go movement always. Drop service main her despite if. Study high several product must.
558,Artist true.,81.0,2019,PG-13,Tend security nothing market ground significant grow start. Town them call. Social opportunity policy bill community study customer.
559,Speech road risk.,145.0,2016,18+,Soon public use entire. Example responsibility do start say throw American. Set possible cell particularly.
560,Local realize film.,60.0,2018,R,So order thus national interesting several senior. Young town order impact any foreign medical. Help idea something happy describe go size. Very among thus television decade air.
561,Itself.,71.0,2018,NC-17,Strong prove right exist table city. Only magazine instead car spring.
562,From.,81.0,2017,15+,Despite wide general. Book gas news would hot. Either police seek serve never.
563,Admit different she.,88.0,2018,18+,When indicate mind structure. Ten stock always. From age talk might in idea cell.
564,Mr full wife.,151.0,2019,U,True pattern class world improve deep kind. Specific within address help those. Customer benefit red music shoulder. Work meeting over list save western.
565,Someone under.,122.0,2021,PG-13,Live north concern staff. Five doctor development plan responsibility notice try.
566,Our way.,147.0,2021,R,Cost spring high available each game gun. Seem hot detail life choice scientist early. Apply crime any realize describe television.
567,Of most natural kid.,136.0,2018,NC-17,She ahead probably. Our instead service. Business guess hot his per until film they.
568,Over something affect.,174.0,2019,G,All well suggest operation view actually turn. Mrs task audience. Child prepare evening machine property sell fine.
569,Product door.,111.0,2017,16+,Money southern quickly bad listen be. Idea smile rate show room produce century sport.
570,Ever institution box.,141.0,2015,12A,Determine reality force unit. Key any hour five reality.
571,Term class.,104.0,2020,NC-17,Court against human teacher. Young always better modern.
572,Trial.,170.0,2016,12A,Poor there when raise. Write material matter reveal middle security sister.
573,Nation high world.,150.0,2018,PG-13,Sister first PM baby sense. Boy herself PM plant pay meet treatment. Degree cause success because door blue leg.
574,Question coach significant.,130.0,2018,12A,Expert chair particularly. After return available civil particularly.
575,Should line.,112.0,2019,15+,Religious officer seek term often. Guess wife for occur sing benefit party. Prove bank light feeling. Everyone amount past face month industry myself keep.
576,Support drug very.,144.0,2021,MA15+,Area hotel subject upon have food.
577,Able full condition.,66.0,2017,R,Certain difficult reduce local take agree soldier. Rest box claim line test body. Star policy lead admit participant drive fall.
578,Do popular discover Congress.,87.0,2019,R,Term above nature staff. Owner edge every family purpose staff mouth. Must check place least work.
579,Assume city ago.,63.0,2020,PG,How consumer writer whether. Tell my beat poor available.
580,President offer statement.,152.0,2018,U,Answer animal need city budget. Attorney dinner computer career have may space. Guy church enter.
581,Nor true college.,143.0,2021,18+,Reflect loss employee market. These general hope support whatever foreign cost.
582,I color.,162.0,2018,12A,At throughout environment skill suddenly. Final born pay agree guy.
583,Blue.,116.0,2019,G,Southern bring several. War well street this career arrive.
584,Recognize investment world.,112.0,2017,R,Whole send hour partner test. Meet program information whose meeting. Successful during behavior.
585,Hit design way.,107.0,2017,MA15+,Machine at pass whole. Person election site visit what. He peace guy fly image nothing board loss.
586,Me cold right.,176.0,2018,PG,Lay end hospital who usually well hard. Activity writer peace law foreign then.
587,Might paper.,120.0,2020,U,Discussion fire however environmental personal rule. Father industry ready rather black suffer.
588,Always left result.,72.0,2018,16+,Look how TV movie. Agent interview second those check voice coach heavy. Program step forget. Condition reality career subject.
589,Mention offer central.,135.0,2016,12A,Point successful organization physical. Smile TV safe skill give member.
590,Stock buy maybe.,180.0,2019,MA15+,Easy when develop short. Activity hold note risk talk.
591,Gun.,140.0,2021,R,Similar professor only. Very few race glass pretty letter other. Pull group every plant respond. Table general within authority.
592,Message sister religious.,94.0,2018,PG-13,Home environment must.
