filmID,title,duration,productionYear,ageCategoryName,filmDescription
793,Participant may.,70.0,2020,18+,Involve I measure drive condition early. Meet doctor in center treatment citizen one.
794,Rule draw yeah.,102.0,2016,12A,Argue name whether popular. Offer news source herself in page expert provide. Reach person event recognize window hour chance area.
795,Wife increase.,173.0,2017,NC-17,Style glass right sign. Several measure system than either car. Safe southern address four. Media nearly mother key study.
796,Television hospital candidate.,86.0,2019,NC-17,Buy area world resource. Stock degree air analysis science rest. Buy reduce debate although product table laugh.
797,Left whom.,157.0,2020,U,Share carry drop minute. Fast between culture give make analysis. Stuff use pick recent left father from.
798,Event age money available.,167.0,2015,R,Follow argue as article so model. Politics clear big hold operation name.
799,Approach just.,99.0,2019,NC-17,Service report western officer discuss. Raise professor still quickly factor movement.
800,Nature myself.,150.0,2018,MA15+,Trade indeed perform identify rest.
801,Stage sea forward toward.,155.0,2018,PG-13,Create threat rest history. Toward history history can movie hospital whose relate. Event color style back moment read board.
802,Son research record.,161.0,2019,MA15+,Lawyer after herself mention.
803,Himself.,130.0,2019,NC-17,Evening three nor these. Street bank compare college yard rich find.
804,But because reality.,130.0,2016,14A,Without actually inside. Throughout against ready will.
805,Well political.,114.0,2018,MA15+,Some true collection night open. Level stage raise discussion mouth.
806,Result majority admit.,89.0,2015,18+,In choose tough scientist. Head meeting at.
807,Push now.,124.0,2019,U,Always she listen message show career. Plant memory tend paper need. Board loss support statement machine worry against.
808,Phone like population.,90.0,2020,18+,Risk woman sound cold movie. Institution show return artist mention institution.
809,Job class keep.,117.0,2016,PG,Bed understand edge state. Government whatever across try family analysis draw around. Lose consider year generation reduce home team up. Free skill summer later.
810,Account performance.,85.0,2016,MA15+,Dog center today particular. Authority prevent the computer during finish guy. Well within everybody debate ok. Third go receive save.
811,Speak open.,143.0,2017,12A,Follow close happen they act public or. Though law three group finally probably toward. Occur plan national when about relationship since rather.
812,Interest feel.,81.0,2017,14A,Important work chance expect feel back election. Notice scene about until computer far.
813,Of land.,68.0,2018,12A,Born peace clearly. Economy catch hospital organization. Hard similar popular chance father with. Police build data space.
814,Real.,102.0,2018,G,Force service local. Attack type scene quickly become shake member week.
815,Clearly there body three.,78.0,2018,14A,Scene art still. Speak there reduce keep stay. Bank nothing must interest.
816,Understand wind seat.,88.0,2018,12A,Space even already value fight before phone project. Wrong question save see particularly born.
817,Put.,168.0,2016,15+,Majority rather because cover environment others sea. War million prepare concern central.
818,Morning see debate.,139.0,2017,NC-17,Energy degree major. Open stay run base majority either.
819,Clearly business.,103.0,2022,14A,Present site office whether run we. Want poor finally recent result beyond set.
820,Late.,154.0,2016,MA15+,Form article available national wear team. Newspaper story drive note spend.
821,Two.,79.0,2017,PG-13,Also traditional song section attorney face soldier.
822,Sport character watch.,67.0,2020,MA15+,Somebody agreement fear account friend soon two marriage. Suffer writer great accept. Tell along relationship how.
823,Evidence industry.,107.0,2017,NC-17,Air speech threat animal plant. Green free go ask approach affect.
824,Life hear.,160.0,2020,14A,Before around though risk never half. Several discuss decade.
825,Skill meeting hit.,88.0,2018,G,Physical turn because easy administration. Quality protect fly money claim never remember court. Color wish the career might stuff. Capital phone case voice represent law.
826,Which.,115.0,2017,18+,Board never majority stay. Structure remember society weight road current choice.
827,Deal none.,100.0,2020,16+,Claim nor two standard care born and TV.
828,Poor.,75.0,2018,15+,Offer already minute word full. Plant rate me could skill.
829,Fund decade return.,170.0,2018,15+,Room give herself with big black even listen. Physical new discussion magazine bring prepare. Finish song financial none development decide.
830,Lay store trip section.,167.0,2020,12A,Air policy president man enter reality point citizen. Give they worker factor else. Position away be building.
831,Style letter.,160.0,2021,U,Stage TV past defense two. Deal laugh rule effect. Environment within tough anyone structure lose. Want investment American as spend draw material.
832,Rock affect.,102.0,2016,R,Idea personal player sea. Happen will majority although within rise quickly. Yeah trouble artist already. Writer appear wide garden environment opportunity.
833,Member force middle.,119.0,2018,NC-17,Really nice notice most his. Benefit speak suddenly old quickly star follow. Kitchen apply to law many.
834,Fear eat effect.,135.0,2017,NC-17,Occur film kind media. Eight practice career form resource home he available. Stay account check west people.
835,Paper religious.,60.0,2020,NC-17,Author population only western student allow level south. Main claim morning outside blood.
836,Court trade.,148.0,2016,16+,Nearly hotel none fill month. Positive cultural hand idea heavy plan meet.
837,Upon financial education.,89.0,2021,NC-17,Voice before night manage yard minute true maybe. Finally second degree agreement financial outside.
838,School send party.,150.0,2020,14A,Career nor minute the million traditional goal. Growth seem build recently note watch game.
839,Party international almost.,92.0,2016,18+,Which student line address mission response. Campaign three soldier city physical heart civil western.
840,Rise pay word.,175.0,2020,14A,Ever back just avoid. Bring mean doctor compare fight question listen. Interview best less window day while again.
841,Wonder assume both.,167.0,2016,15+,Form safe because use newspaper finish. Program participant artist surface to type happy.
842,Team reduce brother.,165.0,2018,NC-17,Their modern party often follow. Lay Republican top explain toward trouble evidence.
843,Specific concern drug.,167.0,2018,18+,Imagine agree method brother might plan indicate either. International feeling identify meet citizen. Benefit investment national fish cover. Vote he not wait court.
844,Feel discuss better.,96.0,2021,MA15+,Ask front morning interest prevent air take west.
845,Character strategy describe force.,137.0,2018,16+,Traditional day finish full director wear. Forward fly remain stage. Herself career democratic person benefit choice beyond.
846,Trade model each.,153.0,2017,G,Activity air less account agreement pick. Few allow part name yourself.
847,Deep seem.,156.0,2017,PG-13,Maybe suffer including rather. Rock away night daughter.
848,Too indicate student.,163.0,2020,PG-13,Debate amount edge everything protect lot. Alone billion second nothing score cut north.
849,Back town individual.,72.0,2018,G,Probably scientist create reflect century. Particularly lot TV special dinner pick suggest road. Wall half my one truth street.
850,Pick upon.,180.0,2016,12A,Hair another and management environmental. Future great since natural before imagine.
851,Pattern pretty somebody.,63.0,2017,U,Education relationship court success prevent reach hot.
852,Color bad ok majority.,132.0,2019,NC-17,Call across which. Only so support away experience them before right.
853,But medical look.,74.0,2019,MA15+,Capital strategy fast present with wrong begin. Together suggest three. Never send system see western above phone.
854,Threat cost.,138.0,2019,12A,Art policy pressure degree. Church west include option professional describe. West different list.
855,Who may.,127.0,2019,NC-17,Remember prepare commercial model learn.
856,When young.,125.0,2017,G,Especially by final sense hundred. Dream seek project citizen. Structure those star seek.
857,It benefit very.,150.0,2016,NC-17,Body idea watch yes. Thousand lose capital left sound situation.
858,Down consider son.,86.0,2021,PG-13,Authority wish food modern mean process. Land young tonight week must. Throw marriage tree check him television.
859,Sister any reveal.,105.0,2018,12A,That film national able. Middle write stand.
860,Six cell character.,63.0,2021,16+,Difficult beyond religious step. Finish themselves where avoid recognize stop beat.
861,Specific.,61.0,2021,NC-17,Worker education section dark realize forward. Down young lose interest fine. Whole Republican order store per argue.
862,Marriage throughout.,136.0,2019,PG-13,Series likely order benefit. Job energy provide understand action.
863,Unit again.,92.0,2015,12A,Run bank safe security away. Effort democratic professional.
864,Defense defense.,73.0,2018,14A,Wish less catch hold eye hundred. Black type read meeting here minute increase.
865,His third.,86.0,2019,G,Science along arrive main protect perform. Suddenly paper special yet last moment. Parent film establish sometimes chair.
866,Risk reveal medical.,96.0,2018,12A,Goal during responsibility key want send painting. Account time without option.
867,Throw laugh seek.,167.0,2017,15+,Election theory floor outside stuff news some. Item test question market scientist young husband. Hour in around trade interview card future.
868,Make certainly worry culture.,112.0,2016,G,Ok issue two green kind. Have prepare option every share. Story put present down policy room all meet.
869,Fine well pass behind.,82.0,2020,PG,Suggest break certain.
870,Glass parent per manager.,140.0,2015,16+,Group deal event operation once. Build lay well so exactly behavior.
871,Social I rule.,150.0,2019,U,Consumer rich them bed yourself. Minute mean scientist themselves. Product south right together.
872,Feel.,78.0,2022,NC-17,Else difference value. Tell alone break. Discussion a between member that site like.
873,Quality hot Mrs.,171.0,2020,NC-17,Million must adult new experience enter. Plant be condition science grow blue him follow. Whom Congress explain each discover keep trouble. Seem interest not cost imagine month animal.
874,Yeah organization.,98.0,2018,12A,Edge material tree on law certain choice season. Girl role everyone actually eight determine available.
875,Assume result.,94.0,2021,PG,Could practice fish natural particularly job. Rest collection management beautiful relationship past. Before against total manage wait rest produce.
876,Laugh nature structure.,175.0,2018,18+,Send use arrive none cause drive race. He fly image commercial. Teacher wrong manager firm baby. Skin level page quite.
877,Certain minute.,171.0,2020,NC-17,Agree any central learn out boy know. Could social table him.
878,Interview institution.,169.0,2016,U,Job hospital mind oil level exist. Number require soon. West a benefit north.
879,Pretty anything.,101.0,2020,15+,Low PM believe more father mean voice. Able green type ok threat learn still. Best begin agent front collection design.
880,New story mind.,179.0,2019,PG-13,Successful recent onto fire several. Economic model stop course many. American player everyone prepare.
881,Father ahead commercial.,112.0,2019,15+,Lead series economic small scene human total movie. Ball food believe hair face time white.
882,Someone material.,95.0,2018,14A,Likely discuss administration strong fall. Many about out what.
883,Stock network.,163.0,2020,15+,Evidence although much oil blood. Land page allow environment prove development change author. Language top career enjoy worker research brother.
884,Oil against.,86.0,2018,18+,Everybody lot use box administration figure.
885,When.,149.0,2018,18+,Impact administration goal week side always. Huge provide choice sign commercial black least share. Effect son represent factor little clear.
886,Improve family individual.,128.0,2020,U,Since wrong generation evening easy top. Suffer five around son effect.
887,Stand inside.,66.0,2018,R,Heart recently discussion like truth explain. Three simple senior paper body. Head perform degree second compare game food.
888,Join more another then.,135.0,2022,16+,Water article story. Green safe happy accept water here. Ready forget part by support easy guess.
889,Its stage.,136.0,2016,16+,Upon rock eat happen discuss next. Remain hard true describe step.
890,Foreign all.,104.0,2020,12A,Difficult everything school easy rich if hear. Serious pattern subject strategy describe explain age.
891,Discuss paper learn.,179.0,2016,MA15+,Author feeling poor position several then month. Dinner if tend agree scene network.
892,Environmental easy activity government.,159.0,2016,15+,Cost when according fund adult himself.
893,Possible listen.,126.0,2016,U,Serve father other. Wind too baby able.
894,Painting tell.,149.0,2017,12A,Human analysis red issue. Face itself seem.
895,Meet pick.,140.0,2016,16+,Middle boy nearly maybe. Believe again to sport money realize company.
896,Consumer send.,115.0,2017,16+,Activity three imagine big. Song how fire economic. Opportunity gas area treatment official. Set himself to weight feel writer vote.
897,Part who I.,141.0,2017,NC-17,Concern before beyond. These remember bar institution owner station whole.
898,Price happen.,91.0,2019,18+,Paper record treat focus speech. Spend management might baby though feel. Cause own per identify future step.
899,Appear card.,74.0,2015,NC-17,Oil white protect. Them event beautiful understand month where. Organization when prevent.
900,Arrive choose black.,117.0,2017,G,By eat especially little.
901,View site current because.,115.0,2018,14A,Edge establish today lose community think technology western. Make there sing economy.
902,These.,91.0,2022,PG,Save building throughout after. Ever close product people.
903,Series decide.,139.0,2020,15+,Government imagine unit main imagine natural mission occur. Congress including begin detail argue me quickly develop. He choice total hold poor.
904,All.,87.0,2017,12A,Executive item theory nation firm. Structure its fish weight road analysis language. Up performance note strong range eat truth true.
905,Scientist say.,141.0,2021,12A,Data you down with myself magazine seem. Rate economic south country teacher.
906,Where me.,129.0,2021,18+,Able would line need claim recently first. Science tonight up state.
907,Mother hit forward.,65.0,2017,MA15+,Hot enter shoulder effort visit. Why score office now agent down marriage my.
908,On bar defense.,138.0,2016,18+,Kind wall and sense least lead. Notice anything middle physical. Collection team claim fly.
909,Must heart night.,178.0,2019,MA15+,Scientist term stuff off. Take into laugh soldier direction. Top certain project stand.
910,A section.,76.0,2018,14A,Painting sister opportunity tough clear blue green. Why gun admit no movie.
911,Suffer there condition.,92.0,2021,PG-13,Account leg bring none camera spring toward five. Bank determine kid image hand eye. She drive month million push result right.
912,Firm treatment.,107.0,2016,R,Candidate fine unit reflect chance first door. Nature international close language rise. Impact many act institution simple idea. Begin service source continue carry concern.
913,Idea well then.,139.0,2022,R,Able behind look girl appear dream answer. Level suggest remember decade civil ok increase. Sit country program camera or adult foreign. Somebody require thought together huge treatment.
914,Individual college will.,113.0,2016,U,Main consider available professional where. Happy allow main.
915,Miss knowledge.,92.0,2020,PG,Throughout suddenly use such policy view activity. With some direction majority trouble.
916,Suggest.,88.0,2021,R,Floor generation positive medical chair. Improve quite report medical site about. Themselves certainly opportunity remember have kid describe.
917,Its friend different.,167.0,2019,MA15+,Herself real forward similar business energy cup. Ready pressure care risk. Detail either culture foot live many success.
918,Clearly.,127.0,2020,PG-13,Remember along young pattern data series both. After air produce style. Outside above whatever marriage least south gas. She red pull prepare civil.
919,Training project age computer.,103.0,2021,NC-17,Type opportunity listen enjoy light standard. Sometimes front foot use wonder young thus. Often body thus sea bank on issue.
920,Everyone sport.,96.0,2018,12A,Various nature yourself general join. Hope raise city government. Open concern clear seem begin store.
921,Close him wide.,113.0,2020,14A,Image kitchen save provide strong six rule. Successful name the travel well including water. Fly parent food other no though address.
922,Certainly professional year.,108.0,2020,18+,Second movement itself hard. Particularly strong onto painting company turn. Along especially player country play should. Degree animal son which pay size election.
923,Open throw cause.,95.0,2022,18+,People apply there customer. Senior top hundred garden.
924,Fear.,93.0,2021,U,Nice water radio than decision. Thing hope budget reveal.
925,Product often modern.,74.0,2020,MA15+,Light however summer team blood try maybe. Lot would so sound.
926,South outside.,70.0,2021,NC-17,Matter until fact model dream process public. Choice any character old main president north scientist. Kid win wife.
927,Ready culture value industry.,98.0,2016,15+,Economic relate especially. Stage conference carry interview thing always arrive. Half set offer could also too PM.
928,Director entire top less.,150.0,2015,MA15+,Factor mention plan skill production eight. Several plant stuff single within much.
929,Fly expect.,146.0,2016,PG-13,Common decade ability art at movement standard. Result factor available future.
930,Effort medical century.,87.0,2019,18+,That these fast agreement game manage animal. Happen shake take leader fact tough.
931,Past probably.,117.0,2019,U,Enough give represent break. Federal its war according letter. Air red suffer kitchen thousand. Rather daughter develop high.
932,The respond.,156.0,2020,G,Run off despite though or seek his. Station act table a trip include.
933,Possible.,93.0,2019,NC-17,Radio wear popular fire yes month might. Factor painting community collection field remember support fund. Present beautiful activity challenge chance.
934,Pull behind.,180.0,2018,PG-13,Think admit no among. Response those there hot house.
935,Read control hope.,149.0,2016,MA15+,Local treatment stop keep offer actually stuff. Five accept prevent into notice.
936,How laugh weight.,67.0,2022,PG,Draw why individual season green trouble board paper. Practice reflect them think occur defense everything. Ask long history.
937,Think image bank.,178.0,2019,15+,Hundred article always. Politics space however store good. Month fall offer compare.
938,Term.,96.0,2022,14A,Policy by city remain pick specific subject. Order often process us cell. Pass market call bad teacher stay.
939,Lose reduce.,140.0,2018,18+,Identify detail board after. Appear color his doctor. Leave bad away trade nice.
940,Research list.,132.0,2020,G,Kid save edge mean your. Until process reveal arrive support low including professional. Write information front move. Risk picture order positive fast movie near.
941,Play economic space.,160.0,2018,PG,Reason dog specific recognize. Hospital box law assume. Defense next door.
942,Size scene.,71.0,2017,R,Water director development enjoy yet middle. Hundred car work set almost listen quality. Early far stand.
943,Daughter board.,121.0,2019,PG,Air bar main foreign deal. Often institution team rise significant behind eye. Both local measure where.
944,Dinner might who.,120.0,2020,G,Unit indicate sense season across. According them fear fly could Democrat number. Weight morning record skin yeah.
945,South report.,86.0,2022,18+,Though knowledge our have act inside. Condition ready successful seek. Knowledge trip study these.
946,Close during even.,154.0,2020,G,A power onto expect. Once option ground.
947,Training south.,106.0,2016,PG-13,Focus suffer first else human newspaper. Audience per anyone sister room.
948,Might southern assume.,153.0,2015,12A,Discussion shoulder food perform deal service game. Theory point budget travel score room. Key pull parent within music. Game animal nearly ever.
949,Mention participant past.,95.0,2020,PG-13,Fund early area next factor mind remain. Air contain house bad safe should.
950,Fight agree.,166.0,2020,U,Recent again could receive. Able include official decision treat month sense job. Sit shoulder there attention matter.
951,Outside partner ground.,114.0,2019,G,Material force describe it. Forward sign whom you else method message.
952,Whose not.,145.0,2017,R,Lose first poor attention. Right machine ready.
953,From later believe.,153.0,2017,U,Lose too leave site move floor along. Later understand know why evidence. Long response strong fly move throughout school.
954,Care send.,165.0,2018,15+,Page than animal education similar those wait. Billion him fine can issue.
955,Space under trip.,144.0,2019,14A,Contain win order street history strong home American. Development PM various population.
956,Somebody blue.,131.0,2018,18+,Man investment where inside wonder result final. Organization medical foot exactly property sport among. Open point join edge middle natural skin window.
957,Career.,65.0,2022,R,When woman set sell fast morning company. Property create carry new. Six energy idea no alone organization before.
958,Pressure newspaper speak into.,140.0,2015,PG,Speak newspaper unit six know sing culture water. Herself same sign when staff blue feeling hear.
959,Third.,63.0,2020,MA15+,Bring school research those provide west finish. Gas cut process she. Pass final group modern turn cover.
960,None focus trip.,175.0,2022,PG-13,Ask natural away right easy economic never. Should enough week doctor just wide. Property cold medical west visit.
961,Seek child.,71.0,2020,16+,Firm yard establish for southern. Address building source toward. Environmental individual trade future.
962,Bit son.,77.0,2017,NC-17,Prevent very yet degree stand east.
963,Bit region.,98.0,2017,PG,Feel simply floor region enjoy role speech leader. Expert husband itself ok technology send kid. Not paper offer traditional growth go.
964,Institution activity president mission.,85.0,2019,12A,Much notice pull they list. Certainly require player pretty many.
965,Leader question.,102.0,2020,14A,Whole husband hot like everything military. Administration individual cultural seven serve ask. Age ready media stand.
966,Magazine prove.,110.0,2018,U,Among just will practice interesting must girl. Answer poor local once understand represent save. Near catch manage design decision health data two. Measure travel drop strategy food expert.
967,Door everyone.,137.0,2021,12A,Kitchen decade bag. Especially song us senior. Sense run turn detail note.
968,Power grow.,93.0,2018,U,Whatever thus measure guess. Would remain body treat feeling have attack.
969,Less same hold.,70.0,2019,G,This anyone today most level. Leg box job around budget successful worry institution.
970,Perform natural.,164.0,2018,G,Report market we amount particular. Actually what land course open.
971,Especially conference money.,102.0,2022,NC-17,Never piece tonight structure against task recognize. Simply design real instead. Turn small yard through team.
972,Report cup.,123.0,2019,18+,Arm thought morning. Individual pick put reduce player chair buy.
973,Building pattern.,102.0,2017,12A,Century modern activity level fast door. Very mind to. Scene call wall budget nice.
974,Interest according probably.,133.0,2019,16+,Seem reveal trouble election effect plant whatever. Energy world let. Myself catch house space population off better.
975,Seek floor.,176.0,2021,18+,Leg per music. Cultural no smile fund ball could whose. Attack mission keep of surface agency.
976,Politics yeah.,88.0,2021,R,Yourself able politics view never capital happen. Notice budget peace evening. Former floor or house last.
977,Both always.,71.0,2018,NC-17,Painting doctor food enjoy field stage.
978,Just before and.,151.0,2018,NC-17,Eye teach bit little. Official nor already hope.
979,Key until low.,64.0,2020,15+,Skin her stock total trip sound. Born plan body indeed now since. Their spend option seven spend dark rock.
980,Interest so.,123.0,2016,PG-13,Firm human federal until. Necessary yourself a national Democrat safe score. Seat study voice study true these.
981,Challenge physical four.,164.0,2016,R,Government rest age beat. Rest choice social five draw party read.
982,Sometimes perform medical.,170.0,2019,R,Total long teacher box American white.
983,Special company.,102.0,2020,PG,Majority maintain account work kitchen common. Drive treat today down full year cover. Her leader partner name spend him. Protect actually although baby.
984,Part material.,113.0,2017,18+,Although nothing shoulder the degree eye. Imagine return street low collection new. Improve million material push.
985,Again direction.,135.0,2018,PG,Sometimes nearly speech read plant guess. Factor instead prove develop game rule loss high. Food sing side something total be rather.
986,Off.,67.0,2020,15+,Better let audience financial white single above. Together project society would past beyond.
987,Against story.,159.0,2022,16+,Real enter bring somebody. Research bed year you.
988,Activity expect.,99.0,2019,12A,Difference include respond almost simply never. Door our news candidate since available maybe. Stay no leg ask.
